{
  "claims_made": [
    "review_reference",
    "source_identity"
  ],
  "claims_not_made": [
    "No rating, load capacity, torque capacity, or safety factor is claimed.",
    "No certification, compliance, price, inventory, or availability is claimed.",
    "No generated STEP geometry is certified by this evidence artifact alone."
  ],
  "evidence_sources": [
    {
      "artifact_kind": "catalog_page",
      "locator": "https://www.servocity.com/2mm-pitch-gt2-pinion-timing-pulley-5mm-bore-20-tooth/",
      "notes": "Manufacturer product URL recorded as source identity evidence.",
      "observed_at": "2026-06-10",
      "retrieval_status": "provided_url_not_fetched",
      "source_type": "manufacturer",
      "trusted_for": [
        "source_identity",
        "review_only"
      ]
    }
  ],
  "extensions": {
    "generator": "tools/generate_source_lock_evidence.py",
    "package": "work/compact_belt_drive_module/package"
  },
  "id": "compact_belt_drive_module.motor_pulley_20t_5mm.source_lock",
  "interface_signature_refs": [
    "belt.gt2_6mm.layout"
  ],
  "interface_signature_role": "layout_reference_only",
  "kind": "source_lock_evidence",
  "lock_status": "source_locked",
  "part_id": "motor_pulley_20t_5mm",
  "part_role": "standard_part",
  "required_before_final": [
    "Import the locked source geometry in the downstream CAD harness.",
    "Run geometry checks for required datums, axes, interfaces, and clearances.",
    "Stop if source geometry changes an approved locked layout fact.",
    "Download or obtain linked STEP/spec sheet, confirm belt width, hub/flange width, set-screw placement, and shaft engagement before final CAD."
  ],
  "schema_version": "0.8.0",
  "source_identity": {
    "display_name": "ServoCity 2mm pitch GT2 pinion timing pulley, 5mm bore, 20 tooth candidate",
    "identity_basis": "manufacturer_url",
    "manufacturer_name": "ServoCity",
    "model": "3422-0005-0020",
    "product_url": "https://www.servocity.com/2mm-pitch-gt2-pinion-timing-pulley-5mm-bore-20-tooth/"
  }
}
